{
  "type": "contribution",
  "project_id": "ff94e89d9fb7b6e8f293cbb2eb50a9dc5b5a088abc75b6ba352e7d0ea809ca1c",
  "contributor_key": "828c0b23e115589cd5708e9bf1578a37c231152225cf5aa35e3ea3bffc721924",
  "role": "Lead Dev",
  "description_hash": "ff916084a8ae6c8c611d67b0e6af7e4e0cca077bbc3d2858737f2357dbbbe99f",
  "description_text": "Initial Commit",
  "created_at": "2025-12-16T06:42:49.425285Z",
  "signature": "3720f46c6908fb1de26cbcef87e97fc3f9a594fa671d421b1e418d3badbf1b984aa1b58024489fb9502a9c3fd381e92aaff639621c12b998d6326207ffcdee08"
}